1. DROP EMPTY TABLE
CREATE TABLE Drop_table_1(id int, t_name char);
SUCCESS
DROP TABLE Drop_table_1;
SUCCESS

2. DROP NON-EMPTY TABLE
CREATE TABLE Drop_table_2(id int, t_name char);
SUCCESS
INSERT INTO Drop_table_2 VALUES (1,'OB');
SUCCESS
DROP TABLE Drop_table_2;
SUCCESS

3. CHECK THE ACCURACY OF DROPPING TABLE
CREATE TABLE Drop_table_3(id int, t_name char);
SUCCESS
INSERT INTO Drop_table_3 VALUES (1,'OB');
SUCCESS
SELECT * FROM Drop_table_3;
1 | OB
ID | T_NAME
DROP TABLE Drop_table_3;
SUCCESS
INSERT INTO Drop_table_3 VALUES (1,'OB');
FAILURE
SELECT * FROM Drop_table_3;
FAILURE
DELETE FROM Drop_table_3 WHERE id = 3;
FAILURE
CREATE TABLE Drop_table_3(id int, t_name char);
SUCCESS
SELECT * FROM Drop_table_3;
ID | T_NAME

4. DROP NON-EXISTENT TABLE
CREATE TABLE Drop_table_4(id int, t_name char);
SUCCESS
DROP TABLE Drop_table_4;
SUCCESS
DROP TABLE Drop_table_4;
FAILURE
DROP TABLE Drop_table_4_1;
FAILURE

5. CREATE A TABLE WHICH HAS DROPPED
CREATE TABLE Drop_table_5(id int, t_name char);
SUCCESS
DROP TABLE Drop_table_5;
SUCCESS
CREATE TABLE Drop_table_5(id int, t_name char);
SUCCESS
SELECT * FROM Drop_table_5;
ID | T_NAME

6. DROP A TABLE WITH INDEX
CREATE TABLE Drop_table_6(id int, t_name char);
SUCCESS
CREATE INDEX index_id on Drop_table_6(id);
SUCCESS
INSERT INTO Drop_table_6 VALUES (1,'OB');
SUCCESS
SELECT * FROM Drop_table_6;
1 | OB
ID | T_NAME
DROP TABLE Drop_table_6;
SUCCESS
SELECT * FROM Drop_table_6;
FAILURE
