INITIALIZATION
CREATE TABLE DATE_TABLE(ID INT, U_DATE DATE);
SUCCESS
CREATE INDEX INDEX_ID ON DATE_TABLE(U_DATE);
SUCCESS

1. INSERT NORMAL DATE DATA
INSERT INTO DATE_TABLE VALUES (1,'2020-01-21');
SUCCESS
INSERT INTO DATE_TABLE VALUES (2,'2020-10-21');
SUCCESS
INSERT INTO DATE_TABLE VALUES (3,'2020-1-01');
SUCCESS
INSERT INTO DATE_TABLE VALUES (4,'2020-01-1');
SUCCESS
INSERT INTO DATE_TABLE VALUES (5,'2019-12-21');
SUCCESS
INSERT INTO DATE_TABLE VALUES (6,'2016-2-29');
SUCCESS
INSERT INTO DATE_TABLE VALUES (7,'1970-1-1');
SUCCESS
INSERT INTO DATE_TABLE VALUES (8,'2000-01-01');
SUCCESS
INSERT INTO DATE_TABLE VALUES (9,'2038-1-19');
SUCCESS

2. COMPARE DATE DATA
SELECT * FROM DATE_TABLE WHERE U_DATE>'2020-1-20';
1 | 2020-01-21
2 | 2020-10-21
9 | 2038-01-19
ID | U_DATE
SELECT * FROM DATE_TABLE WHERE U_DATE<'2019-12-31';
5 | 2019-12-21
6 | 2016-02-29
7 | 1970-01-01
8 | 2000-01-01
ID | U_DATE
SELECT * FROM DATE_TABLE WHERE U_DATE='2020-1-1';
3 | 2020-01-01
4 | 2020-01-01
ID | U_DATE

3. DELETE DATA
DELETE FROM DATE_TABLE WHERE U_DATE>'2012-2-29';
SUCCESS
SELECT * FROM DATE_TABLE;
7 | 1970-01-01
8 | 2000-01-01
ID | U_DATE

4. CHECK INVALID DATE DATA
SELECT * FROM DATE_TABLE WHERE U_DATE='2017-2-29';
FAILURE
SELECT * FROM DATE_TABLE WHERE U_DATE='2017-21-29';
FAILURE
SELECT * FROM DATE_TABLE WHERE U_DATE='2017-12-32';
FAILURE
SELECT * FROM DATE_TABLE WHERE U_DATE='2017-11-31';
FAILURE

INSERT INTO DATE_TABLE VALUES (10,'2017-2-29');
FAILURE
INSERT INTO DATE_TABLE VALUES (11,'2017-21-29');
FAILURE
INSERT INTO DATE_TABLE VALUES (12,'2017-12-32');
FAILURE
INSERT INTO DATE_TABLE VALUES (13,'2017-11-31');
FAILURE
