INITIALIZATION
create table text_table(id int, info text);
SUCCESS

1. INSERT
insert into text_table values (1,'this is a very very long string');
SUCCESS
insert into text_table values (2,'this is a very very long string2');
SUCCESS
insert into text_table values (3,'this is a very very long string3');
SUCCESS
select * from text_table;
1 | THIS IS A VERY VERY LONG STRING
2 | THIS IS A VERY VERY LONG STRING2
3 | THIS IS A VERY VERY LONG STRING3
ID | INFO

2. CONDITION
delete from text_table where id=1;
SUCCESS
select * from text_table;
2 | THIS IS A VERY VERY LONG STRING2
3 | THIS IS A VERY VERY LONG STRING3
ID | INFO

3. UPDATE
UPDATE text_table set info='a tmp data' where id = 2;
SUCCESS
select * from text_table;
2 | A TMP DATA
3 | THIS IS A VERY VERY LONG STRING3
ID | INFO

4. BOUNDARY TEST WITH LENGTH 4096
insert into text_table values (4,'this is a very very long string pad pad pad pad pad pad pad pad pad pad pad pad pad pad pad pad pad pad pad pad pad pad pad pad pad pad pad pad pad pad pad pad pad pad pad pad pad pad pad pad pad pad pad pad pad pad pad pad pad pad pad pad pad pad pad pad pad pad pad pad pad pad pad pad pad pad pad pad pad pad pad pad pad pad pad pad pad pad pad pad pad pad pad pad pad pad pad pad pad pad pad pad pad pad pad pad pad pad pad pad pad pad pad pad pad pad pad pad pad pad pad pad pad pad pad pad pad pad pad pad pad pad pad pad pad pad pad pad pad pad pad pad pad pad pad pad pad pad pad pad pad pad pad pad pad pad pad pad pad pad pad pad pad pad pad pad pad pad pad pad pad pad pad pad pad pad pad pad pad pad pad pad pad pad pad pad pad pad pad pad pad pad pad pad pad pad pad pad pad pad pad pad pad pad pad pad pad pad pad pad pad pad pad pad pad pad pad pad pad pad pad pad pad pad pad pad pad pad pad pad pad pad pad pad pad pad pad pad pad pad pad pad pad pad pad pad pad pad pad pad pad pad pad pad pad pad pad pad pad pad pad pad pad pad pad pad pad pad pad pad pad pad pad pad pad pad pad pad pad pad pad pad pad pad pad pad pad pad pad pad pad pad pad pad pad pad pad pad pad pad pad pad pad pad pad pad pad pad pad pad pad pad pad pad pad pad pad pad pad pad pad pad pad pad pad pad pad pad pad pad pad pad pad pad pad pad pad pad pad pad pad pad pad pad pad pad pad pad pad pad pad pad pad pad pad pad pad pad pad pad pad pad pad pad pad pad pad pad pad pad pad pad pad pad pad pad pad pad pad pad pad pad pad pad pad pad pad pad pad pad pad pad pad pad pad pad pad pad pad pad pad pad pad pad pad pad pad pad pad pad pad pad pad pad pad pad pad pad pad pad pad pad pad pad pad pad pad pad pad pad pad pad pad pad pad pad pad pad pad pad pad pad pad pad pad pad pad pad pad pad pad pad pad pad pad pad pad pad pad pad pad pad pad pad pad pad pad pad pad pad pad pad pad pad pad pad pad pad pad pad pad pad pad pad pad pad pad pad pad pad pad pad pad pad pad pad pad pad pad pad pad pad pad pad pad pad pad pad pad pad pad pad pad pad pad pad pad pad pad pad pad pad pad pad pad pad pad pad pad pad pad pad pad pad pad pad pad pad pad pad pad pad pad pad pad pad pad pad pad pad pad pad pad pad pad pad pad pad pad pad pad pad pad pad pad pad pad pad pad pad pad pad pad pad pad pad pad pad pad pad pad pad pad pad pad pad pad pad pad pad pad pad pad pad pad pad pad pad pad pad pad pad pad pad pad pad pad pad pad pad pad pad pad pad pad pad pad pad pad pad pad pad pad pad pad pad pad pad pad pad pad pad pad pad pad pad pad pad pad pad pad pad pad pad pad pad pad pad pad pad pad pad pad pad pad pad pad pad pad pad pad pad pad pad pad pad pad pad pad pad pad pad pad pad pad pad pad pad pad pad pad pad pad pad pad pad pad pad pad pad pad pad pad pad pad pad pad pad pad pad pad pad pad pad pad pad pad pad pad pad pad pad pad pad pad pad pad pad pad pad pad pad pad pad pad pad pad pad pad pad pad pad pad pad pad pad pad pad pad pad pad pad pad pad pad pad pad pad pad pad pad pad pad pad pad pad pad pad pad pad pad pad pad pad pad pad pad pad pad pad pad pad pad pad pad pad pad pad pad pad pad pad pad pad pad pad pad pad pad pad pad pad pad pad pad pad pad pad pad pad pad pad pad pad pad pad pad pad pad pad pad pad pad pad pad pad pad pad pad pad pad pad pad pad pad pad pad pad pad pad pad pad pad pad pad pad pad pad pad pad pad pad pad pad pad pad pad pad pad pad pad pad pad pad pad pad pad pad pad pad pad pad pad pad pad pad pad pad pad pad pad pad pad pad pad pad pad pad pad pad pad pad pad pad pad pad pad pad pad pad pad pad pad pad pad pad pad pad pad pad pad pad pad pad pad pad pad pad pad pad pad pad pad pad pad pad pad pad pad pad pad pad pad pad pad pad pad pad pad pad pad pad pad pad pad pad pad pad pad pad pad pad pad pad pad pad pad pad pad pad pad pad pad pad pad pad pad pad pad pad pad pad pad pad pad pad pad pad pad pad pad pad pad pad pad pad pad pad pad pad pad pad pad pad pad pad pad pad pad pad pad pad pad pad pad pad pad pad pad pad pad pad pad pad pad pad pad pad pad pad pad pad pad pad pad pad pad pad pad pad pad pad pad pad pad pad1');
SUCCESS
select * from text_table;
2 | A TMP DATA
3 | THIS IS A VERY VERY LONG STRING3
4 | THIS IS A VERY VERY LONG STRING PAD PAD PAD PAD PAD PAD PAD PAD PAD PAD PAD PAD PAD PAD PAD PAD PAD PAD PAD PAD PAD PAD PAD PAD PAD PAD PAD PAD PAD PAD PAD PAD PAD PAD PAD PAD PAD PAD PAD PAD PAD PAD PAD PAD PAD PAD PAD PAD PAD PAD PAD PAD PAD PAD PAD PAD PAD PAD PAD PAD PAD PAD PAD PAD PAD PAD PAD PAD PAD PAD PAD PAD PAD PAD PAD PAD PAD PAD PAD PAD PAD PAD PAD PAD PAD PAD PAD PAD PAD PAD PAD PAD PAD PAD PAD PAD PAD PAD PAD PAD PAD PAD PAD PAD PAD PAD PAD PAD PAD PAD PAD PAD PAD PAD PAD PAD PAD PAD PAD PAD PAD PAD PAD PAD PAD PAD PAD PAD PAD PAD PAD PAD PAD PAD PAD PAD PAD PAD PAD PAD PAD PAD PAD PAD PAD PAD PAD PAD PAD PAD PAD PAD PAD PAD PAD PAD PAD PAD PAD PAD PAD PAD PAD PAD PAD PAD PAD PAD PAD PAD PAD PAD PAD PAD PAD PAD PAD PAD PAD PAD PAD PAD PAD PAD PAD PAD PAD PAD PAD PAD PAD PAD PAD PAD PAD PAD PAD PAD PAD PAD PAD PAD PAD PAD PAD PAD PAD PAD PAD PAD PAD PAD PAD PAD PAD PAD PAD PAD PAD PAD PAD PAD PAD PAD PAD PAD PAD PAD PAD PAD PAD PAD PAD PAD PAD PAD PAD PAD PAD PAD PAD PAD PAD PAD PAD PAD PAD PAD PAD PAD PAD PAD PAD PAD PAD PAD PAD PAD PAD PAD PAD PAD PAD PAD PAD PAD PAD PAD PAD PAD PAD PAD PAD PAD PAD PAD PAD PAD PAD PAD PAD PAD PAD PAD PAD PAD PAD PAD PAD PAD PAD PAD PAD PAD PAD PAD PAD PAD PAD PAD PAD PAD PAD PAD PAD PAD PAD PAD PAD PAD PAD PAD PAD PAD PAD PAD PAD PAD PAD PAD PAD PAD PAD PAD PAD PAD PAD PAD PAD PAD PAD PAD PAD PAD PAD PAD PAD PAD PAD PAD PAD PAD PAD PAD PAD PAD PAD PAD PAD PAD PAD PAD PAD PAD PAD PAD PAD PAD PAD PAD PAD PAD PAD PAD PAD PAD PAD PAD PAD PAD PAD PAD PAD PAD PAD PAD PAD PAD PAD PAD PAD PAD PAD PAD PAD PAD PAD PAD PAD PAD PAD PAD PAD PAD PAD PAD PAD PAD PAD PAD PAD PAD PAD PAD PAD PAD PAD PAD PAD PAD PAD PAD PAD PAD PAD PAD PAD PAD PAD PAD PAD PAD PAD PAD PAD PAD PAD PAD PAD PAD PAD PAD PAD PAD PAD PAD PAD PAD PAD PAD PAD PAD PAD PAD PAD PAD PAD PAD PAD PAD PAD PAD PAD PAD PAD PAD PAD PAD PAD PAD PAD PAD PAD PAD PAD PAD PAD PAD PAD PAD PAD PAD PAD PAD PAD PAD PAD PAD PAD PAD PAD PAD PAD PAD PAD PAD PAD PAD PAD PAD PAD PAD PAD PAD PAD PAD PAD PAD PAD PAD PAD PAD PAD PAD PAD PAD PAD PAD PAD PAD PAD PAD PAD PAD PAD PAD PAD PAD PAD PAD PAD PAD PAD PAD PAD PAD PAD PAD PAD PAD PAD PAD PAD PAD PAD PAD PAD PAD PAD PAD PAD PAD PAD PAD PAD PAD PAD PAD PAD PAD PAD PAD PAD PAD PAD PAD PAD PAD PAD PAD PAD PAD PAD PAD PAD PAD PAD PAD PAD PAD PAD PAD PAD PAD PAD PAD PAD PAD PAD PAD PAD PAD PAD PAD PAD PAD PAD PAD PAD PAD PAD PAD PAD PAD PAD PAD PAD PAD PAD PAD PAD PAD PAD PAD PAD PAD PAD PAD PAD PAD PAD PAD PAD PAD PAD PAD PAD PAD PAD PAD PAD PAD PAD PAD PAD PAD PAD PAD PAD PAD PAD PAD PAD PAD PAD PAD PAD PAD PAD PAD PAD PAD PAD PAD PAD PAD PAD PAD PAD PAD PAD PAD PAD PAD PAD PAD PAD PAD PAD PAD PAD PAD PAD PAD PAD PAD PAD PAD PAD PAD PAD PAD PAD PAD PAD PAD PAD PAD PAD PAD PAD PAD PAD PAD PAD PAD PAD PAD PAD PAD PAD PAD PAD PAD PAD PAD PAD PAD PAD PAD PAD PAD PAD PAD PAD PAD PAD PAD PAD PAD PAD PAD PAD PAD PAD PAD PAD PAD PAD PAD PAD PAD PAD PAD PAD PAD PAD PAD PAD PAD PAD PAD PAD PAD PAD PAD PAD PAD PAD PAD PAD PAD PAD PAD PAD PAD PAD PAD PAD PAD PAD PAD PAD PAD PAD PAD PAD PAD PAD PAD PAD PAD PAD PAD PAD PAD PAD PAD PAD PAD PAD PAD PAD PAD PAD PAD PAD PAD PAD PAD PAD PAD PAD PAD PAD PAD PAD PAD PAD PAD PAD PAD PAD PAD PAD PAD PAD PAD PAD PAD PAD PAD PAD PAD PAD PAD PAD PAD PAD PAD PAD PAD PAD PAD PAD PAD PAD PAD PAD PAD PAD PAD PAD PAD PAD PAD PAD PAD PAD PAD PAD PAD PAD PAD PAD PAD PAD PAD PAD PAD PAD PAD PAD PAD PAD PAD PAD PAD PAD PAD PAD PAD PAD PAD PAD PAD PAD PAD PAD PAD PAD PAD PAD PAD PAD PAD PAD PAD PAD PAD PAD PAD PAD PAD PAD PAD PAD PAD PAD PAD PAD PAD PAD PAD PAD PAD PAD PAD PAD PAD PAD PAD PAD PAD PAD PAD PAD PAD PAD PAD PAD PAD PAD PAD PAD PAD PAD PAD PAD PAD PAD PAD PAD PAD PAD PAD PAD PAD PAD PAD PAD PAD PAD PAD PAD PAD PAD PAD PAD PAD PAD PAD PAD PAD PAD PAD PAD PAD PAD PAD PAD PAD PAD PAD PAD PAD PAD PAD PAD PAD PAD PAD PAD PAD PAD PAD PAD PAD PAD PAD PAD PAD PAD PAD PAD PAD PAD PAD PAD PAD PAD PAD PAD PAD PAD PAD PAD PAD PAD PAD PAD PAD PAD PAD PAD PAD PAD PAD PAD PAD PAD PAD PAD PAD PAD PAD PAD PAD PAD PAD PAD PAD PAD PAD PAD PAD PAD PAD PAD PAD PAD PAD PAD PAD PAD PAD1
ID | INFO

insert into text_table values (5,'this is a very very long string pad pad pad pad pad pad pad pad pad pad pad pad pad pad pad pad pad pad pad pad pad pad pad pad pad pad pad pad pad pad pad pad pad pad pad pad pad pad pad pad pad pad pad pad pad pad pad pad pad pad pad pad pad pad pad pad pad pad pad pad pad pad pad pad pad pad pad pad pad pad pad pad pad pad pad pad pad pad pad pad pad pad pad pad pad pad pad pad pad pad pad pad pad pad pad pad pad pad pad pad pad pad pad pad pad pad pad pad pad pad pad pad pad pad pad pad pad pad pad pad pad pad pad pad pad pad pad pad pad pad pad pad pad pad pad pad pad pad pad pad pad pad pad pad pad pad pad pad pad pad pad pad pad pad pad pad pad pad pad pad pad pad pad pad pad pad pad pad pad pad pad pad pad pad pad pad pad pad pad pad pad pad pad pad pad pad pad pad pad pad pad pad pad pad pad pad pad pad pad pad pad pad pad pad pad pad pad pad pad pad pad pad pad pad pad pad pad pad pad pad pad pad pad pad pad pad pad pad pad pad pad pad pad pad pad pad pad pad pad pad pad pad pad pad pad pad pad pad pad pad pad pad pad pad pad pad pad pad pad pad pad pad pad pad pad pad pad pad pad pad pad pad pad pad pad pad pad pad pad pad pad pad pad pad pad pad pad pad pad pad pad pad pad pad pad pad pad pad pad pad pad pad pad pad pad pad pad pad pad pad pad pad pad pad pad pad pad pad pad pad pad pad pad pad pad pad pad pad pad pad pad pad pad pad pad pad pad pad pad pad pad pad pad pad pad pad pad pad pad pad pad pad pad pad pad pad pad pad pad pad pad pad pad pad pad pad pad pad pad pad pad pad pad pad pad pad pad pad pad pad pad pad pad pad pad pad pad pad pad pad pad pad pad pad pad pad pad pad pad pad pad pad pad pad pad pad pad pad pad pad pad pad pad pad pad pad pad pad pad pad pad pad pad pad pad pad pad pad pad pad pad pad pad pad pad pad pad pad pad pad pad pad pad pad pad pad pad pad pad pad pad pad pad pad pad pad pad pad pad pad pad pad pad pad pad pad pad pad pad pad pad pad pad pad pad pad pad pad pad pad pad pad pad pad pad pad pad pad pad pad pad pad pad pad pad pad pad pad pad pad pad pad pad pad pad pad pad pad pad pad pad pad pad pad pad pad pad pad pad pad pad pad pad pad pad pad pad pad pad pad pad pad pad pad pad pad pad pad pad pad pad pad pad pad pad pad pad pad pad pad pad pad pad pad pad pad pad pad pad pad pad pad pad pad pad pad pad pad pad pad pad pad pad pad pad pad pad pad pad pad pad pad pad pad pad pad pad pad pad pad pad pad pad pad pad pad pad pad pad pad pad pad pad pad pad pad pad pad pad pad pad pad pad pad pad pad pad pad pad pad pad pad pad pad pad pad pad pad pad pad pad pad pad pad pad pad pad pad pad pad pad pad pad pad pad pad pad pad pad pad pad pad pad pad pad pad pad pad pad pad pad pad pad pad pad pad pad pad pad pad pad pad pad pad pad pad pad pad pad pad pad pad pad pad pad pad pad pad pad pad pad pad pad pad pad pad pad pad pad pad pad pad pad pad pad pad pad pad pad pad pad pad pad pad pad pad pad pad pad pad pad pad pad pad pad pad pad pad pad pad pad pad pad pad pad pad pad pad pad pad pad pad pad pad pad pad pad pad pad pad pad pad pad pad pad pad pad pad pad pad pad pad pad pad pad pad pad pad pad pad pad pad pad pad pad pad pad pad pad pad pad pad pad pad pad pad pad pad pad pad pad pad pad pad pad pad pad pad pad pad pad pad pad pad pad pad pad pad pad pad pad pad pad pad pad pad pad pad pad pad pad pad pad pad pad pad pad pad pad pad pad pad pad pad pad pad pad pad pad pad pad pad pad pad pad pad pad pad pad pad pad pad pad pad pad pad pad pad pad pad pad pad pad pad pad pad pad pad pad pad pad pad pad pad pad pad pad pad pad pad pad pad pad pad pad pad pad pad pad pad pad pad pad pad pad pad pad pad pad pad pad pad pad pad pad pad pad pad pad pad pad pad pad pad pad pad pad pad pad pad pad pad pad pad pad pad pad pad pad pad pad pad pad pad pad pad pad pad pad pad pad pad pad pad pad pad pad pad pad pad pad pad pad pad pad pad pad pad pad pad pad pad pad pad pad pad pad pad pad pad pad pad pad pad pad pad pad pad pad pad pad pad pad pad pad pad pad pad pad pad pad pad pad pad pad pad pad pad pad pad pad pad pad pad pad pad pad pad pad pad pad pad pad pad pad pad1 pad pad pad pad');
SUCCESS
select * from text_table;
2 | A TMP DATA
3 | THIS IS A VERY VERY LONG STRING3
4 | THIS IS A VERY VERY LONG STRING PAD PAD PAD PAD PAD PAD PAD PAD PAD PAD PAD PAD PAD PAD PAD PAD PAD PAD PAD PAD PAD PAD PAD PAD PAD PAD PAD PAD PAD PAD PAD PAD PAD PAD PAD PAD PAD PAD PAD PAD PAD PAD PAD PAD PAD PAD PAD PAD PAD PAD PAD PAD PAD PAD PAD PAD PAD PAD PAD PAD PAD PAD PAD PAD PAD PAD PAD PAD PAD PAD PAD PAD PAD PAD PAD PAD PAD PAD PAD PAD PAD PAD PAD PAD PAD PAD PAD PAD PAD PAD PAD PAD PAD PAD PAD PAD PAD PAD PAD PAD PAD PAD PAD PAD PAD PAD PAD PAD PAD PAD PAD PAD PAD PAD PAD PAD PAD PAD PAD PAD PAD PAD PAD PAD PAD PAD PAD PAD PAD PAD PAD PAD PAD PAD PAD PAD PAD PAD PAD PAD PAD PAD PAD PAD PAD PAD PAD PAD PAD PAD PAD PAD PAD PAD PAD PAD PAD PAD PAD PAD PAD PAD PAD PAD PAD PAD PAD PAD PAD PAD PAD PAD PAD PAD PAD PAD PAD PAD PAD PAD PAD PAD PAD PAD PAD PAD PAD PAD PAD PAD PAD PAD PAD PAD PAD PAD PAD PAD PAD PAD PAD PAD PAD PAD PAD PAD PAD PAD PAD PAD PAD PAD PAD PAD PAD PAD PAD PAD PAD PAD PAD PAD PAD PAD PAD PAD PAD PAD PAD PAD PAD PAD PAD PAD PAD PAD PAD PAD PAD PAD PAD PAD PAD PAD PAD PAD PAD PAD PAD PAD PAD PAD PAD PAD PAD PAD PAD PAD PAD PAD PAD PAD PAD PAD PAD PAD PAD PAD PAD PAD PAD PAD PAD PAD PAD PAD PAD PAD PAD PAD PAD PAD PAD PAD PAD PAD PAD PAD PAD PAD PAD PAD PAD PAD PAD PAD PAD PAD PAD PAD PAD PAD PAD PAD PAD PAD PAD PAD PAD PAD PAD PAD PAD PAD PAD PAD PAD PAD PAD PAD PAD PAD PAD PAD PAD PAD PAD PAD PAD PAD PAD PAD PAD PAD PAD PAD PAD PAD PAD PAD PAD PAD PAD PAD PAD PAD PAD PAD PAD PAD PAD PAD PAD PAD PAD PAD PAD PAD PAD PAD PAD PAD PAD PAD PAD PAD PAD PAD PAD PAD PAD PAD PAD PAD PAD PAD PAD PAD PAD PAD PAD PAD PAD PAD PAD PAD PAD PAD PAD PAD PAD PAD PAD PAD PAD PAD PAD PAD PAD PAD PAD PAD PAD PAD PAD PAD PAD PAD PAD PAD PAD PAD PAD PAD PAD PAD PAD PAD PAD PAD PAD PAD PAD PAD PAD PAD PAD PAD PAD PAD PAD PAD PAD PAD PAD PAD PAD PAD PAD PAD PAD PAD PAD PAD PAD PAD PAD PAD PAD PAD PAD PAD PAD PAD PAD PAD PAD PAD PAD PAD PAD PAD PAD PAD PAD PAD PAD PAD PAD PAD PAD PAD PAD PAD PAD PAD PAD PAD PAD PAD PAD PAD PAD PAD PAD PAD PAD PAD PAD PAD PAD PAD PAD PAD PAD PAD PAD PAD PAD PAD PAD PAD PAD PAD PAD PAD PAD PAD PAD PAD PAD PAD PAD PAD PAD PAD PAD PAD PAD PAD PAD PAD PAD PAD PAD PAD PAD PAD PAD PAD PAD PAD PAD PAD PAD PAD PAD PAD PAD PAD PAD PAD PAD PAD PAD PAD PAD PAD PAD PAD PAD PAD PAD PAD PAD PAD PAD PAD PAD PAD PAD PAD PAD PAD PAD PAD PAD PAD PAD PAD PAD PAD PAD PAD PAD PAD PAD PAD PAD PAD PAD PAD PAD PAD PAD PAD PAD PAD PAD PAD PAD PAD PAD PAD PAD PAD PAD PAD PAD PAD PAD PAD PAD PAD PAD PAD PAD PAD PAD PAD PAD PAD PAD PAD PAD PAD PAD PAD PAD PAD PAD PAD PAD PAD PAD PAD PAD PAD PAD PAD PAD PAD PAD PAD PAD PAD PAD PAD PAD PAD PAD PAD PAD PAD PAD PAD PAD PAD PAD PAD PAD PAD PAD PAD PAD PAD PAD PAD PAD PAD PAD PAD PAD PAD PAD PAD PAD PAD PAD PAD PAD PAD PAD PAD PAD PAD PAD PAD PAD PAD PAD PAD PAD PAD PAD PAD PAD PAD PAD PAD PAD PAD PAD PAD PAD PAD PAD PAD PAD PAD PAD PAD PAD PAD PAD PAD PAD PAD PAD PAD PAD PAD PAD PAD PAD PAD PAD PAD PAD PAD PAD PAD PAD PAD PAD PAD PAD PAD PAD PAD PAD PAD PAD PAD PAD PAD PAD PAD PAD PAD PAD PAD PAD PAD PAD PAD PAD PAD PAD PAD PAD PAD PAD PAD PAD PAD PAD PAD PAD PAD PAD PAD PAD PAD PAD PAD PAD PAD PAD PAD PAD PAD PAD PAD PAD PAD PAD PAD PAD PAD PAD PAD PAD PAD PAD PAD PAD PAD PAD PAD PAD PAD PAD PAD PAD PAD PAD PAD PAD PAD PAD PAD PAD PAD PAD PAD PAD PAD PAD PAD PAD PAD PAD PAD PAD PAD PAD PAD PAD PAD PAD PAD PAD PAD PAD PAD PAD PAD PAD PAD PAD PAD PAD PAD PAD PAD PAD PAD PAD PAD PAD PAD PAD PAD PAD PAD PAD PAD PAD PAD PAD PAD PAD PAD PAD PAD PAD PAD PAD PAD PAD PAD PAD PAD PAD PAD PAD PAD PAD PAD PAD PAD PAD PAD PAD PAD PAD PAD PAD PAD PAD PAD PAD PAD PAD PAD PAD PAD PAD PAD PAD PAD PAD PAD PAD PAD PAD PAD PAD PAD PAD PAD PAD PAD PAD PAD PAD PAD PAD PAD PAD PAD PAD PAD PAD PAD PAD PAD PAD PAD PAD PAD PAD PAD PAD PAD PAD PAD PAD PAD PAD PAD PAD PAD PAD PAD PAD PAD PAD PAD PAD PAD PAD PAD PAD PAD PAD PAD PAD PAD PAD PAD PAD PAD PAD PAD PAD PAD PAD PAD PAD PAD PAD PAD PAD PAD PAD PAD PAD PAD PAD PAD PAD PAD PAD PAD PAD PAD PAD PAD PAD PAD PAD PAD PAD PAD PAD PAD PAD PAD PAD PAD PAD PAD PAD PAD PAD PAD PAD PAD PAD PAD PAD PAD PAD PAD PAD PAD PAD PAD PAD PAD PAD PAD PAD PAD1
5 | THIS IS A VERY VERY LONG STRING PAD PAD PAD PAD PAD PAD PAD PAD PAD PAD PAD PAD PAD PAD PAD PAD PAD PAD PAD PAD PAD PAD PAD PAD PAD PAD PAD PAD PAD PAD PAD PAD PAD PAD PAD PAD PAD PAD PAD PAD PAD PAD PAD PAD PAD PAD PAD PAD PAD PAD PAD PAD PAD PAD PAD PAD PAD PAD PAD PAD PAD PAD PAD PAD PAD PAD PAD PAD PAD PAD PAD PAD PAD PAD PAD PAD PAD PAD PAD PAD PAD PAD PAD PAD PAD PAD PAD PAD PAD PAD PAD PAD PAD PAD PAD PAD PAD PAD PAD PAD PAD PAD PAD PAD PAD PAD PAD PAD PAD PAD PAD PAD PAD PAD PAD PAD PAD PAD PAD PAD PAD PAD PAD PAD PAD PAD PAD PAD PAD PAD PAD PAD PAD PAD PAD PAD PAD PAD PAD PAD PAD PAD PAD PAD PAD PAD PAD PAD PAD PAD PAD PAD PAD PAD PAD PAD PAD PAD PAD PAD PAD PAD PAD PAD PAD PAD PAD PAD PAD PAD PAD PAD PAD PAD PAD PAD PAD PAD PAD PAD PAD PAD PAD PAD PAD PAD PAD PAD PAD PAD PAD PAD PAD PAD PAD PAD PAD PAD PAD PAD PAD PAD PAD PAD PAD PAD PAD PAD PAD PAD PAD PAD PAD PAD PAD PAD PAD PAD PAD PAD PAD PAD PAD PAD PAD PAD PAD PAD PAD PAD PAD PAD PAD PAD PAD PAD PAD PAD PAD PAD PAD PAD PAD PAD PAD PAD PAD PAD PAD PAD PAD PAD PAD PAD PAD PAD PAD PAD PAD PAD PAD PAD PAD PAD PAD PAD PAD PAD PAD PAD PAD PAD PAD PAD PAD PAD PAD PAD PAD PAD PAD PAD PAD PAD PAD PAD PAD PAD PAD PAD PAD PAD PAD PAD PAD PAD PAD PAD PAD PAD PAD PAD PAD PAD PAD PAD PAD PAD PAD PAD PAD PAD PAD PAD PAD PAD PAD PAD PAD PAD PAD PAD PAD PAD PAD PAD PAD PAD PAD PAD PAD PAD PAD PAD PAD PAD PAD PAD PAD PAD PAD PAD PAD PAD PAD PAD PAD PAD PAD PAD PAD PAD PAD PAD PAD PAD PAD PAD PAD PAD PAD PAD PAD PAD PAD PAD PAD PAD PAD PAD PAD PAD PAD PAD PAD PAD PAD PAD PAD PAD PAD PAD PAD PAD PAD PAD PAD PAD PAD PAD PAD PAD PAD PAD PAD PAD PAD PAD PAD PAD PAD PAD PAD PAD PAD PAD PAD PAD PAD PAD PAD PAD PAD PAD PAD PAD PAD PAD PAD PAD PAD PAD PAD PAD PAD PAD PAD PAD PAD PAD PAD PAD PAD PAD PAD PAD PAD PAD PAD PAD PAD PAD PAD PAD PAD PAD PAD PAD PAD PAD PAD PAD PAD PAD PAD PAD PAD PAD PAD PAD PAD PAD PAD PAD PAD PAD PAD PAD PAD PAD PAD PAD PAD PAD PAD PAD PAD PAD PAD PAD PAD PAD PAD PAD PAD PAD PAD PAD PAD PAD PAD PAD PAD PAD PAD PAD PAD PAD PAD PAD PAD PAD PAD PAD PAD PAD PAD PAD PAD PAD PAD PAD PAD PAD PAD PAD PAD PAD PAD PAD PAD PAD PAD PAD PAD PAD PAD PAD PAD PAD PAD PAD PAD PAD PAD PAD PAD PAD PAD PAD PAD PAD PAD PAD PAD PAD PAD PAD PAD PAD PAD PAD PAD PAD PAD PAD PAD PAD PAD PAD PAD PAD PAD PAD PAD PAD PAD PAD PAD PAD PAD PAD PAD PAD PAD PAD PAD PAD PAD PAD PAD PAD PAD PAD PAD PAD PAD PAD PAD PAD PAD PAD PAD PAD PAD PAD PAD PAD PAD PAD PAD PAD PAD PAD PAD PAD PAD PAD PAD PAD PAD PAD PAD PAD PAD PAD PAD PAD PAD PAD PAD PAD PAD PAD PAD PAD PAD PAD PAD PAD PAD PAD PAD PAD PAD PAD PAD PAD PAD PAD PAD PAD PAD PAD PAD PAD PAD PAD PAD PAD PAD PAD PAD PAD PAD PAD PAD PAD PAD PAD PAD PAD PAD PAD PAD PAD PAD PAD PAD PAD PAD PAD PAD PAD PAD PAD PAD PAD PAD PAD PAD PAD PAD PAD PAD PAD PAD PAD PAD PAD PAD PAD PAD PAD PAD PAD PAD PAD PAD PAD PAD PAD PAD PAD PAD PAD PAD PAD PAD PAD PAD PAD PAD PAD PAD PAD PAD PAD PAD PAD PAD PAD PAD PAD PAD PAD PAD PAD PAD PAD PAD PAD PAD PAD PAD PAD PAD PAD PAD PAD PAD PAD PAD PAD PAD PAD PAD PAD PAD PAD PAD PAD PAD PAD PAD PAD PAD PAD PAD PAD PAD PAD PAD PAD PAD PAD PAD PAD PAD PAD PAD PAD PAD PAD PAD PAD PAD PAD PAD PAD PAD PAD PAD PAD PAD PAD PAD PAD PAD PAD PAD PAD PAD PAD PAD PAD PAD PAD PAD PAD PAD PAD PAD PAD PAD PAD PAD PAD PAD PAD PAD PAD PAD PAD PAD PAD PAD PAD PAD PAD PAD PAD PAD PAD PAD PAD PAD PAD PAD PAD PAD PAD PAD PAD PAD PAD PAD PAD PAD PAD PAD PAD PAD PAD PAD PAD PAD PAD PAD PAD PAD PAD PAD PAD PAD PAD PAD PAD PAD PAD PAD PAD PAD PAD PAD PAD PAD PAD PAD PAD PAD PAD PAD PAD PAD PAD PAD PAD PAD PAD PAD PAD PAD PAD PAD PAD PAD PAD PAD PAD PAD PAD PAD PAD PAD PAD PAD PAD PAD PAD PAD PAD PAD PAD PAD PAD PAD PAD PAD PAD PAD PAD PAD PAD PAD PAD PAD PAD PAD PAD PAD PAD PAD PAD PAD PAD PAD PAD PAD PAD PAD PAD PAD PAD PAD PAD PAD PAD PAD PAD PAD PAD PAD PAD PAD PAD PAD PAD PAD PAD PAD PAD PAD PAD PAD PAD PAD PAD PAD PAD PAD PAD PAD PAD PAD PAD PAD PAD PAD PAD PAD PAD PAD PAD PAD PAD PAD PAD PAD PAD PAD PAD PAD PAD PAD PAD PAD PAD PAD PAD PAD PAD PAD PAD PAD PAD PAD PAD PAD PAD PAD PAD PAD PAD PAD PAD PAD PAD PAD PAD PAD PAD PAD PAD PAD PAD1
ID | INFO
