BASIC INSERT

SET EXECUTION_MODE='CHUNK_ITERATOR';
SUCCESS
CREATE TABLE T_BASIC(ID INT, AGE INT, NAME CHAR, SCORE FLOAT) STORAGE FORMAT=PAX;
SUCCESS
INSERT INTO T_BASIC VALUES(1,1, 'A', 1.0);
SUCCESS
INSERT INTO T_BASIC VALUES(2,2, 'B', 2.0);
SUCCESS
INSERT INTO T_BASIC VALUES(4,4, 'C', 3.0);
SUCCESS
INSERT INTO T_BASIC VALUES(3,3, 'D', 4.0);
SUCCESS
INSERT INTO T_BASIC VALUES(5,5, 'E', 5.5);
SUCCESS
INSERT INTO T_BASIC VALUES(6,6, 'F', 6.6);
SUCCESS
INSERT INTO T_BASIC VALUES(7,7, 'G', 7.7);
SUCCESS

SELECT * FROM T_BASIC;
1 | 1 | A | 1
2 | 2 | B | 2
3 | 3 | D | 4
4 | 4 | C | 3
5 | 5 | E | 5.5
6 | 6 | F | 6.6
7 | 7 | G | 7.7
ID | AGE | NAME | SCORE

BASIC DELETE
DELETE FROM T_BASIC WHERE ID=3;
SUCCESS
SELECT * FROM T_BASIC;
1 | 1 | A | 1
2 | 2 | B | 2
4 | 4 | C | 3
5 | 5 | E | 5.5
6 | 6 | F | 6.6
7 | 7 | G | 7.7
ID | AGE | NAME | SCORE

BASIC SELECT
SELECT * FROM T_BASIC WHERE ID=1;
ID | AGE | NAME | SCORE
1 | 1 | A | 1

SELECT * FROM T_BASIC WHERE ID>=5;
5 | 5 | E | 5.5
6 | 6 | F | 6.6
7 | 7 | G | 7.7
ID | AGE | NAME | SCORE

SELECT * FROM T_BASIC WHERE AGE>1 AND AGE<3;
ID | AGE | NAME | SCORE
2 | 2 | B | 2

SELECT * FROM T_BASIC WHERE T_BASIC.ID=1 AND T_BASIC.AGE=1;
ID | AGE | NAME | SCORE
1 | 1 | A | 1

SELECT * FROM T_BASIC WHERE ID=1 AND AGE=1;
ID | AGE | NAME | SCORE
1 | 1 | A | 1

SELECT ID, AGE, NAME, SCORE FROM T_BASIC;
1 | 1 | A | 1
2 | 2 | B | 2
4 | 4 | C | 3
5 | 5 | E | 5.5
6 | 6 | F | 6.6
7 | 7 | G | 7.7
ID | AGE | NAME | SCORE

SELECT T_BASIC.ID, T_BASIC.AGE, T_BASIC.NAME, T_BASIC.SCORE FROM T_BASIC;
1 | 1 | A | 1
2 | 2 | B | 2
4 | 4 | C | 3
5 | 5 | E | 5.5
6 | 6 | F | 6.6
7 | 7 | G | 7.7
ID | AGE | NAME | SCORE

SELECT T_BASIC.ID, T_BASIC.AGE, NAME FROM T_BASIC;
1 | 1 | A
2 | 2 | B
4 | 4 | C
5 | 5 | E
6 | 6 | F
7 | 7 | G
ID | AGE | NAME
